{
  "audit_id": "mra_bc7cacb4a61c4b3892084d5ddf1196de",
  "audited_at": "2026-09-01T08:19:40.039Z",
  "checks": [
    {
      "check": "schema_catalog_complete",
      "detail": "catalog=63; files=63",
      "status": "passed"
    },
    {
      "check": "conformance_ano_c",
      "detail": "required=16; profile_passed=15; skipped=1",
      "status": "passed"
    },
    {
      "check": "conformance_ano_p",
      "detail": "required=24; profile_passed=23; skipped=1",
      "status": "passed"
    },
    {
      "check": "conformance_ano_g",
      "detail": "required=42; profile_passed=41; skipped=1",
      "status": "passed"
    },
    {
      "check": "conformance_ano_a",
      "detail": "required=52; profile_passed=51; skipped=1",
      "status": "passed"
    },
    {
      "check": "conformance_ano_s",
      "detail": "required=90; profile_passed=89; skipped=1",
      "status": "passed"
    },
    {
      "check": "mvp_demo_passed",
      "detail": "status=passed; version=0.4.0-alpha.1",
      "status": "passed"
    },
    {
      "check": "mvp_stage_coverage",
      "detail": "four required executable stages are present and passed",
      "status": "passed"
    },
    {
      "check": "negative_controls",
      "detail": "controls=2",
      "status": "passed"
    },
    {
      "check": "mvp_scope_declared",
      "detail": "MVP_RELEASE.md exists",
      "status": "passed"
    },
    {
      "check": "source_hash_bound",
      "detail": "source_hash=sha256:def051357149ac8905e9b173ffe7d49611993cc802ca139fa59f589087d97cf9",
      "status": "passed"
    }
  ],
  "implementation_version": "0.4.0-alpha.1",
  "inventory": {
    "catalog_entries": 63,
    "examples": 51,
    "passed": 97,
    "required_tests": 90,
    "schemas_including_catalog": 64,
    "skipped": 1,
    "state_machines": 12,
    "tests_run": 98
  },
  "remaining_work": [
    {
      "classification": "productionization",
      "item": "\u771f\u5b9e\u591a\u79df\u6237\u6570\u636e\u5e93\u3001\u8de8\u5730\u57df\u9ad8\u53ef\u7528\u4e0e\u5bb9\u91cf\u5de5\u7a0b",
      "mvp_blocking": false
    },
    {
      "classification": "productionization",
      "item": "KMS/HSM\u3001\u7ec4\u7ec7\u8eab\u4efd\u548c\u8fdc\u7a0b\u8bc1\u660e\u96c6\u6210",
      "mvp_blocking": false
    },
    {
      "classification": "independent_certification",
      "item": "\u72ec\u7acb\u5b89\u5168\u8bc4\u4f30\u3001\u6e17\u900f\u6d4b\u8bd5\u548c\u884c\u4e1a\u5408\u89c4\u8ba4\u8bc1",
      "mvp_blocking": false
    },
    {
      "classification": "future_interoperability",
      "item": "\u7b2c\u4e8c\u8bed\u8a00\u5b9e\u73b0\u53ca 0.4 \u8de8\u5b9e\u73b0\u8fc1\u79fb\u6d4b\u8bd5",
      "mvp_blocking": false
    }
  ],
  "schema_version": "0.3.0",
  "status": "passed"
}
